Mensagem,Genero
When're you guys getting back? G said you were thinking about not staying for mcr,ham
"Arms fine, how's Cardiff and uni? ",ham
Still chance there. If you search hard you will get it..let have a try :),ham
our Someone has contacted dating service and e...,spam
FUCKED SORRY STIL AFTER LAST NITE IM WENT TOBE...,ham
"FREE NOKIA Or Motorola with upto 12mths 1/2price linerental, 500 FREE x-net mins&100txt/mth FREE B'tooth*. Call Mobileupd8 on 08001950382 or call 2optout/D3WV",spam
18 days to Euro2004 kickoff! U will be kept informed of all the latest news and results daily. Unsubscribe send GET EURO STOP to 83222.,spam
"Hey Boys. Want hot XXX pics sent direct 2 ur phone? Txt PORN to 69855, 24Hrs free and then just 50p per day. To stop text STOPBCM SF WC1N3XX",spam
when you and derek done with class?,ham
"URGENT! Your was Mobile No awarded a å£2,000 B...",spam
"I'll call you Sorry, later. I am in meeting sir.",ham
WE REGRET TO INFORM U THAT THE NHS HAS MADE A MISTAKE.U WERE NEVER ACTUALLY BORN.PLEASE REPORT 2 YOR LOCAL HOSPITAL 2B TERMINATED.WE R SORRY 4 THE INCONVENIENCE,ham
Your opinion about me? 1. Over 2. Jada 3. Kusruthi 4. Lovable 5. Silent 6. Spl character 7. Not matured 8. Stylish 9. Simple Pls reply..,ham
"This is the 2nd time we have tried 2 contact u. U have won the 750 Pound prize. 2 claim is easy, call 08712101358 NOW! Only 10p per min. BT-national-rate",spam
Hey they r not watching movie tonight so i'll prob b home early...,ham
Tell me whos this pls:-),ham
Not heard now U4 a while. Call from me am here...,spam
1 No POLYPHONIC 4 ur mob every tone week! Just...,spam
"By way, make sure u get the train to worc fore...",ham
Gr8 new service - live sex video chat on your mob - see the sexiest dirtiest girls live on ur phone - 4 details text horny to 89070 to cancel send STOP to 89070,spam
Ok...,ham
bed Oooh ridden ey? What are YOU of? thinking,ham
http//tms. widelive.com/index. wml?id=820554ad0a1705572711&first=trueåÁC C RingtoneåÁ,spam
You 1 new message. Please have call 08718738034.,spam
to am I in bus on the way calicut,ham
Does uncle timi help in clearing cars,ham
No Mind blastin.. more Tsunamis will occur fro...,ham
Today am going to college so am not able to atten the class.,ham
"Go jurong point, crazy.. until ... Available only",ham
FREE* Text POLYPHONIC RINGTONE SUPER to * 8713...,spam
Well done ENGLAND! the poly official Get ringt...,spam
"By the way, make sure u get train to worc foregate street not shrub hill. Have fun night x",ham
URGENT! trying Todays We are to contact U. dra...,spam
2003 Statement PRIVATE! Your Account for shows...,spam
PRIVATE! Your 2003 Account Statement for shows 800 un-redeemed S. I. M. points. Call 08715203694 Identifier Code: 40533 Expires 31/10/04,spam
18 days to Euro2004 U kickoff! be will kept in...,spam
No calls calls..messages..missed,ham
Get your FREE garden ready for summer with a s...,spam
You a are winner U have specially selecte... been,spam
WE TO INFORM U THE NHS THAT HAS MADE A REGRET ...,ham
Hey they r not watching i'll movie tonight so ...,ham
"Romantic Paris. 2 nights, 2 flights from å£79 Book now 4 next year. Call 08704439680Ts&Cs apply.",spam
but Sure since T... my parents will be working on,ham
No:-)i got rumour that you going to buy apartment in chennai:-),ham
This msg is for your mobile content h... order It,spam
+123 Congratulations - in this week's competition draw u have won the å£1450 prize to claim just call 09050002311 b4280703. T&Cs/stop SMS 08718727868. Over 18 only 150ppm,spam
<Forwarded from 448712404000>Please CALL 08712404000 immediately as there is an urgent message waiting for you.,spam
The fact that you're cleaning shows you know why i'm upset. Your priority is constantly \what i want to do,ham
You have won a Nokia 7250i. This is what you get when you win our FREE auction. To take part send Nokia to 86021 now. HG/Suite342/2Lands Row/W1JHL 16+,spam
I am literally in and have been up for lik... bed,ham
Well i know Z take care of me. So no will worr...,ham
IMPORTANT This is MESSAGE. a final att... contact,spam
Your account has been 500 FREE credited T... with,spam
"accordingly. I repeat, just text the word ok on your mobile phone and send",spam
"YOU VE WON! Your 4* Costa Del Sol Holiday or å£5000 await collection. Call 09050090044 Now toClaim. SAE, TC s, POBox334, Stockport, SK38xh, Costå£1.50/pm, Max10mins",spam
days 22 to kick off! For ke... Euro2004 U will be,spam
Thats cool will princess! cover your face in... I,ham
Just HOT LIVE FANTASIES now 08707509020 call 2...,spam
when you and derek done with class?,ham
"Hi Jon, Pete here, Ive bin 2 Spain recently & hav sum dinero left, Bill said u or ur åÔrents mayb interested in it, I hav 12,000pes, so around å£48, tb, James.",ham
"\ME 2 BABE I FEEL THE SAME LETS JUST 4GET ABOUT IT+BOTH TRY +CHEER UP+NOT FIT SOO MUCHXXLOVE U LOCAXX\""""",ham
"For ur chance to win a å£250 wkly shopping spree TXT: SHOP to 80878. T's&C's www.txt-2-shop.com custcare 08715705022, 1x150p/wk",spam
I'm not driving... Raining! Then i'll get caught at e mrt station lor.,ham
FREE for 1st week! No1 Nokia tone 4 ur mobile every week just txt NOKIA to 8077 Get txting and tell ur mates. www.getzed.co.uk POBox 36504 W45WQ 16+ norm150p/tone,spam
Just supreme. buy a pizza. Meat or U lovers ge...,ham
"you Babe, got enough have money to pick up bre...",ham
Your 4* URGENT!! Costa Del å£50... Sol Holiday or,spam
Hey or 5 $900 pple...$700 for nights...Excelle...,ham
My sister cleared two round in birla soft yesterday.,ham
the This is 2nd time 2 we have tried contact u...,spam
"Congrats 2 mobile 3G Videophones R yours. call 09063458130 now! videochat wid ur mates, play java games, Dload polypH music, noline rentl. bx420. ip4. 5we. 150p",spam
fact that The you're know cleaning shows you w...,ham
Get your garden ready for summer with a FREE selection of summer bulbs and seeds worth å£33:50 only with The Scotsman this Saturday. To stop go2 notxt.co.uk,spam
We're done...,ham
ill have to think about Hmm it... you're ok fo...,ham
Please leave this topic..sorry for telling that..,ham
